ธนาคาร,"('ราคาที่ธนาคารรับซื้อ', 'ธนบัตร')","('ราคาที่ธนาคารรับซื้อ', 'ตั๋วเงิน')","('ราคาที่ธนาคารรับซื้อ', 'เช็คเดินทาง')","('ราคาที่ธนาคารรับซื้อ', 'ตั๋วแลกเงิน&ดราฟ')","('ราคาที่ธนาคารรับซื้อ', 'โอนเงินทางโทรเลข/โอนเงิน')","('ราคาที่ธนาคารขาย', 'ธนบัตร')","('ราคาที่ธนาคารขาย', 'เช็คเดินทาง')","('ราคาที่ธนาคารขาย', 'ตั๋วแลกเงิน&ดราฟ')","('ราคาที่ธนาคารขาย', 'โอนเงินทางโทรเลข/โอนเงิน')"
ธนาคารกสิกรไทย,22.82845,23.02662,23.02662,-,23.09037,23.9908,23.64879,23.64879,23.64879
ธนาคารไทยพาณิชย์,22.845,22.865,22.805,-,22.985,24.02125,23.72625,23.72625,-
ธนาคารกรุงเทพ,22.85,-,-,22.97500,23.05000,23.73,-,23.69500,23.69500
ธนาคารกรุงไทย,22.97,23.01,-,-,23.07,23.87,23.69,-,-
ธนาคารกรุงศรีอยุธยา,22.77000,22.86053,-,-,22.95053,24.08000,23.83053,23.83053,23.83053
