ธนาคาร,"('ราคาที่ธนาคารรับซื้อ', 'ธนบัตร')","('ราคาที่ธนาคารรับซื้อ', 'ตั๋วเงิน')","('ราคาที่ธนาคารรับซื้อ', 'เช็คเดินทาง')","('ราคาที่ธนาคารรับซื้อ', 'ตั๋วแลกเงิน&ดราฟ')","('ราคาที่ธนาคารรับซื้อ', 'โอนเงินทางโทรเลข/โอนเงิน')","('ราคาที่ธนาคารขาย', 'ธนบัตร')","('ราคาที่ธนาคารขาย', 'เช็คเดินทาง')","('ราคาที่ธนาคารขาย', 'ตั๋วแลกเงิน&ดราฟ')","('ราคาที่ธนาคารขาย', 'โอนเงินทางโทรเลข/โอนเงิน')"
ธนาคารกสิกรไทย,-,-,-,-,-,-,-,-,-
ธนาคารไทยพาณิชย์,-,-,-,-,-,-,-,-,-
ธนาคารกรุงเทพ,0.27,-,-,-,-,0.37,-,-,-
ธนาคารกรุงไทย,-,-,-,-,-,-,-,-,-
ธนาคารกรุงศรีอยุธยา,-,-,-,-,-,-,-,-,-
