ธนาคาร,"('ราคาที่ธนาคารรับซื้อ', 'ธนบัตร')","('ราคาที่ธนาคารรับซื้อ', 'ตั๋วเงิน')","('ราคาที่ธนาคารรับซื้อ', 'เช็คเดินทาง')","('ราคาที่ธนาคารรับซื้อ', 'ตั๋วแลกเงิน&ดราฟ')","('ราคาที่ธนาคารรับซื้อ', 'โอนเงินทางโทรเลข/โอนเงิน')","('ราคาที่ธนาคารขาย', 'ธนบัตร')","('ราคาที่ธนาคารขาย', 'เช็คเดินทาง')","('ราคาที่ธนาคารขาย', 'ตั๋วแลกเงิน&ดราฟ')","('ราคาที่ธนาคารขาย', 'โอนเงินทางโทรเลข/โอนเงิน')"
ธนาคารกสิกรไทย,1.01833,-,-,-,-,1.17244,-,-,-
ธนาคารไทยพาณิชย์,1.0,-,-,-,-,1.16,-,-,-
ธนาคารกรุงเทพ,1.01,-,-,-,-,1.13,-,-,-
ธนาคารกรุงไทย,1.06,-,-,-,-,1.26,-,-,-
ธนาคารกรุงศรีอยุธยา,0.95000,-,-,-,-,1.32000,-,-,-
