ธนาคาร,"('ราคาที่ธนาคารรับซื้อ', 'ธนบัตร')","('ราคาที่ธนาคารรับซื้อ', 'ตั๋วเงิน')","('ราคาที่ธนาคารรับซื้อ', 'เช็คเดินทาง')","('ราคาที่ธนาคารรับซื้อ', 'ตั๋วแลกเงิน&ดราฟ')","('ราคาที่ธนาคารรับซื้อ', 'โอนเงินทางโทรเลข/โอนเงิน')","('ราคาที่ธนาคารขาย', 'ธนบัตร')","('ราคาที่ธนาคารขาย', 'เช็คเดินทาง')","('ราคาที่ธนาคารขาย', 'ตั๋วแลกเงิน&ดราฟ')","('ราคาที่ธนาคารขาย', 'โอนเงินทางโทรเลข/โอนเงิน')"
ธนาคารกสิกรไทย,33.14616,33.3,33.3,-,33.4,33.816,33.7,33.7,33.7
ธนาคารไทยพาณิชย์,32.31,33.3,33.2,-,33.4,33.76,33.7,33.7,-
ธนาคารกรุงเทพ,33.05,-,-,33.27,33.37,33.77,-,33.67,33.67
ธนาคารกรุงไทย,33.16,-,-,-,-,33.76,-,-,-
ธนาคารกรุงศรีอยุธยา,33.14000,-,-,-,-,33.82000,-,-,-
